,Title,Price
0,【ポイント5倍】APPLE イヤホン・ヘッドホン AirPods 第1世代 MMEF2J/A [タイプ：インナーイヤー 装着方式：完全ワイヤレス(左右分離型)] 【楽天】 【人気】 【売れ筋】【価格】,"27,000円"
1,Apple AirPods 完全ワイヤレスイヤホン Bluetooth対応 マイク付き MMEF2J/A,"27,000円"
2,Apple AirPods with Wireless Charging Case MRXJ2J/A【在庫あり（1〜3営業日程度での発送）】,"25,725円"
3,APPLE ワイヤレスイヤホン AirPods with Wireless Charging Case MRXJ2J/A,"25,444円"
4,【即納】Apple 第2世代 エアポッド ワイヤレス充電ケース付き MRXJ2J/A AirPods with Wireless Charging Case ブルートゥース イヤホン MRXJ2JA アップル【送料無料】【KK9N0D18P】,"24,980円"
5,Apple AirPods with Wireless Charging Case (最新モデル),"24,800円"
6,APPLE アップル AirPods with Wireless Charging Case エアポッド 新作 MRXJ2J/A 第2世代 ワイヤレスイヤホン Bluetooth 本体,"24,399円"
7,APPLE イヤホン・ヘッドホン AirPods 第1世代 MMEF2J/A [タイプ：インナーイヤー 装着方式：完全ワイヤレス(左右分離型)] 【楽天】 【人気】 【売れ筋】【価格】,"24,300円"
8,APPLE ワイヤレスイヤホン AirPods with Charging Case MV7N2J/A,"24,063円"
9,【14時までの注文で即日発送】【2019年最新モデル】【エアポッズ2】 Apple AirPods with Wireless Charging Case エアポッズ エアーポッズ　2　2019　ワイヤレス　アップル 新品 未開封　純正　新作　最新,"24,000円"
